{
  "package_id": "47bdff67-e58b-5437-919b-ec00159afbc5",
  "release": 1,
  "schema_version": 1,
  "min_reader_version": 1,
  "published_at": "2026-10-09T12:00:00Z",
  "kind": "demo",
  "counts": {
    "products": 18,
    "rations": 1,
    "components": 18,
    "sources": 1
  },
  "sources": [
    {
      "source_id": "571bc0bc-0ce2-57ca-b248-7dd43079bdda",
      "document_id": "docs/materialy/racja_wojskowa_S-RG-1.source.json",
      "url": null,
      "checked_on": "2026-10-09",
      "market": null,
      "manufacturer": null,
      "variant": "S-RG-1 (oznaczenie próbki użytkownika)",
      "basis": "assumed_listed_quantity",
      "status": "unverified",
      "missing_data": [
        "Etykiety i producent każdego produktu.",
        "Jawna podstawa wartości odżywczych.",
        "Dane odżywcze czterech pozycji, masy trzech pozycji w sztukach.",
        "Ilości soli/pieprzu i instrukcje przygotowania proszków."
      ],
      "notes": [
        "Sprawdzono wyłącznie lokalny materiał; bez weryfikacji etykiet.",
        "Założenie demo: wartości dotyczą podanej ilości; per 100 g = wartość × 100 / masa, HALF_UP do 6 miejsc.",
        "22 pozycje żywności; 18 normalizowanych; 4 bez wartości, w tym 3 w sztukach.",
        "Suma źródłowych pozycji 3466 kcal (z opcjonalnym batonem); podsumowanie 3468 kcal; deklaracja 3600 kcal.",
        "Grupy są układem racji, a optional nie oznacza spożycia.",
        "Wartości odżywcze są orientacyjne, na podstawie wcześniejszego zestawienia, a nie jednej zweryfikowanej etykiety całej racji.",
        "Suma 3468 kcal obejmuje produkty z dostępnymi danymi, w tym opcjonalny baton z galaretką; pomija m.in. cukierki, gumę i kawę.",
        "Sumy podano w przybliżeniu i mogą różnić się o 1–2 kcal od sumy pozycji z powodu zaokrągleń.",
        "Skład może się różnić między partiami produkcyjnymi."
      ]
    }
  ],
  "products": [
    {
      "product_id": "71b3a020-3627-5f95-bdba-e63ef138a7b2",
      "revision": 1,
      "name": "Gulasz drobiowy",
      "aliases": [],
      "brand": null,
      "variant": null,
      "basis_unit": "g",
      "nutrition_per_100": {
        "energy_kcal": "87",
        "protein_g": "11",
        "fat_g": "3.3",
        "carbs_g": "2.9"
      },
      "package_quantity": {
        "amount": "300",
        "unit": "g"
      },
      "density_g_per_ml": null,
      "source_id": "571bc0bc-0ce2-57ca-b248-7dd43079bdda",
      "source_locator": "/posilki/0/produkty/0",
      "status": "unverified",
      "preparation": null
    },
    {
      "product_id": "9ad285ad-b5f6-557d-b02f-2fefc6bf0822",
      "revision": 1,
      "name": "Konserwa tyrolska",
      "aliases": [],
      "brand": null,
      "variant": null,
      "basis_unit": "g",
      "nutrition_per_100": {
        "energy_kcal": "264",
        "protein_g": "16",
        "fat_g": "21",
        "carbs_g": "2.8"
      },
      "package_quantity": {
        "amount": "100",
        "unit": "g"
      },
      "density_g_per_ml": null,
      "source_id": "571bc0bc-0ce2-57ca-b248-7dd43079bdda",
      "source_locator": "/posilki/0/produkty/1",
      "status": "unverified",
      "preparation": null
    },
    {
      "product_id": "20c2b242-55dd-5628-a39a-5c486482a637",
      "revision": 1,
      "name": "Pieczywo chrupkie",
      "aliases": [],
      "brand": null,
      "variant": null,
      "basis_unit": "g",
      "nutrition_per_100": {
        "energy_kcal": "330",
        "protein_g": "8",
        "fat_g": "2.2",
        "carbs_g": "65.4"
      },
      "package_quantity": {
        "amount": "50",
        "unit": "g"
      },
      "density_g_per_ml": null,
      "source_id": "571bc0bc-0ce2-57ca-b248-7dd43079bdda",
      "source_locator": "/posilki/0/produkty/2",
      "status": "unverified",
      "preparation": null
    },
    {
      "product_id": "2c6a5a17-93b1-5327-a42a-7b3f0f364986",
      "revision": 1,
      "name": "Miód pszczeli",
      "aliases": [],
      "brand": null,
      "variant": null,
      "basis_unit": "g",
      "nutrition_per_100": {
        "energy_kcal": "304",
        "protein_g": "0",
        "fat_g": "0",
        "carbs_g": "82.4"
      },
      "package_quantity": {
        "amount": "25",
        "unit": "g"
      },
      "density_g_per_ml": null,
      "source_id": "571bc0bc-0ce2-57ca-b248-7dd43079bdda",
      "source_locator": "/posilki/0/produkty/3",
      "status": "unverified",
      "preparation": null
    },
    {
      "product_id": "abf953fa-3017-593f-94cf-76e74294cd7f",
      "revision": 1,
      "name": "Czekolada do picia bananowa",
      "aliases": [],
      "brand": null,
      "variant": null,
      "basis_unit": "g",
      "nutrition_per_100": {
        "energy_kcal": "408",
        "protein_g": "12",
        "fat_g": "10.4",
        "carbs_g": "62"
      },
      "package_quantity": {
        "amount": "25",
        "unit": "g"
      },
      "density_g_per_ml": null,
      "source_id": "571bc0bc-0ce2-57ca-b248-7dd43079bdda",
      "source_locator": "/posilki/0/produkty/4",
      "status": "unverified",
      "preparation": "Suchy produkt; ilość wody i instrukcja przygotowania nieznane."
    },
    {
      "product_id": "c4e18119-6919-57a3-93d8-08941ec93bde",
      "revision": 1,
      "name": "Napój malinowy instant",
      "aliases": [],
      "brand": null,
      "variant": null,
      "basis_unit": "g",
      "nutrition_per_100": {
        "energy_kcal": "386.666667",
        "protein_g": "0",
        "fat_g": "0",
        "carbs_g": "96"
      },
      "package_quantity": {
        "amount": "15",
        "unit": "g"
      },
      "density_g_per_ml": null,
      "source_id": "571bc0bc-0ce2-57ca-b248-7dd43079bdda",
      "source_locator": "/posilki/0/produkty/5",
      "status": "unverified",
      "preparation": "Suchy produkt; ilość wody i instrukcja przygotowania nieznane."
    },
    {
      "product_id": "709ee435-9e50-54a6-8f63-bd8e0d65d836",
      "revision": 1,
      "name": "Pulpety w sosie warzywnym",
      "aliases": [],
      "brand": null,
      "variant": null,
      "basis_unit": "g",
      "nutrition_per_100": {
        "energy_kcal": "82",
        "protein_g": "8",
        "fat_g": "3.1",
        "carbs_g": "5.1"
      },
      "package_quantity": {
        "amount": "300",
        "unit": "g"
      },
      "density_g_per_ml": null,
      "source_id": "571bc0bc-0ce2-57ca-b248-7dd43079bdda",
      "source_locator": "/posilki/1/produkty/0",
      "status": "unverified",
      "preparation": null
    },
    {
      "product_id": "9a3a41f5-560e-5c9e-b696-cf6cf4f0c5ba",
      "revision": 1,
      "name": "Suchary wojskowe SU-1",
      "aliases": [],
      "brand": null,
      "variant": null,
      "basis_unit": "g",
      "nutrition_per_100": {
        "energy_kcal": "385.555556",
        "protein_g": "8",
        "fat_g": "6.777778",
        "carbs_g": "72.111111"
      },
      "package_quantity": {
        "amount": "90",
        "unit": "g"
      },
      "density_g_per_ml": null,
      "source_id": "571bc0bc-0ce2-57ca-b248-7dd43079bdda",
      "source_locator": "/posilki/1/produkty/1",
      "status": "unverified",
      "preparation": null
    },
    {
      "product_id": "75d35d2d-e6ec-513c-98a1-703de17c5d0e",
      "revision": 1,
      "name": "Napój izotoniczny w proszku",
      "aliases": [],
      "brand": null,
      "variant": null,
      "basis_unit": "g",
      "nutrition_per_100": {
        "energy_kcal": "385",
        "protein_g": "0",
        "fat_g": "0",
        "carbs_g": "96"
      },
      "package_quantity": {
        "amount": "40",
        "unit": "g"
      },
      "density_g_per_ml": null,
      "source_id": "571bc0bc-0ce2-57ca-b248-7dd43079bdda",
      "source_locator": "/posilki/1/produkty/2",
      "status": "unverified",
      "preparation": "Suchy produkt; ilość wody i instrukcja przygotowania nieznane."
    },
    {
      "product_id": "824918be-2e74-5da2-81c0-7d7ca49dd255",
      "revision": 1,
      "name": "Owoce liofilizowane",
      "aliases": [],
      "brand": null,
      "variant": null,
      "basis_unit": "g",
      "nutrition_per_100": {
        "energy_kcal": "346.666667",
        "protein_g": "4.666667",
        "fat_g": "1.333333",
        "carbs_g": "75.333333"
      },
      "package_quantity": {
        "amount": "15",
        "unit": "g"
      },
      "density_g_per_ml": null,
      "source_id": "571bc0bc-0ce2-57ca-b248-7dd43079bdda",
      "source_locator": "/posilki/1/produkty/3",
      "status": "unverified",
      "preparation": null
    },
    {
      "product_id": "efe20cdf-6267-59f4-8970-6f6ec0dc1084",
      "revision": 1,
      "name": "Konserwa z boczku",
      "aliases": [],
      "brand": null,
      "variant": null,
      "basis_unit": "g",
      "nutrition_per_100": {
        "energy_kcal": "281.052632",
        "protein_g": "14",
        "fat_g": "25",
        "carbs_g": "0"
      },
      "package_quantity": {
        "amount": "190",
        "unit": "g"
      },
      "density_g_per_ml": null,
      "source_id": "571bc0bc-0ce2-57ca-b248-7dd43079bdda",
      "source_locator": "/posilki/2/produkty/0",
      "status": "unverified",
      "preparation": null
    },
    {
      "product_id": "55077ed8-a067-588a-80de-de2b4f2afa9d",
      "revision": 1,
      "name": "Pieczywo chrupkie",
      "aliases": [],
      "brand": null,
      "variant": null,
      "basis_unit": "g",
      "nutrition_per_100": {
        "energy_kcal": "330",
        "protein_g": "8",
        "fat_g": "2.2",
        "carbs_g": "65.4"
      },
      "package_quantity": {
        "amount": "50",
        "unit": "g"
      },
      "density_g_per_ml": null,